{
  "schemaVersion": "1",
  "kind": "maxwell.session.summary",
  "sessionId": "ses_f5966a878ffe9Eqsv9NxdkApEz",
  "harness": "opencode",
  "harnessVersion": "1.18.30",
  "runId": "run_01M2GDZ3Q3S5WYCB3MV02QJXZ1",
  "workflow": "execute-scr",
  "companyId": "example-co",
  "startedAt": "2026-09-15T19:44:22Z",
  "endedAt": "2026-09-15T20:04:35Z",
  "durationMs": 1213000,
  "turns": 51,
  "inferenceCalls": 51,
  "toolCalls": {
    "total": 90,
    "byTool": {
      "bash": 40,
      "read": 36,
      "grep": 8,
      "glob": 6
    }
  },
  "subagentSessions": 0,
  "permissionDenials": [],
  "models": [
    {
      "model": "glm-5.3",
      "provider": "other",
      "tokens": {
        "input": 228647,
        "output": 88914,
        "cacheWrite5m": 0,
        "cacheWrite1h": 0,
        "cacheRead": 7431744,
        "thinking": null
      },
      "webSearchRequests": 0,
      "webFetchRequests": 0,
      "costUsd": 2.643581
    }
  ],
  "costUsd": {
    "computed": 2.643581,
    "reported": 2.643581,
    "deltaPct": 0
  },
  "pricingVersion": "2026-09-14",
  "dedup": {
    "strategy": "requestId-max-total-tokens",
    "duplicatesDropped": 0
  },
  "filesWritten": [],
  "linesAdded": 0,
  "linesRemoved": 0,
  "outcome": "success",
  "transcriptFormatVersion": "1.18.30",
  "provenance": {
    "harness": "script",
    "generatedAt": "2026-09-15T23:44:52Z",
    "sessionId": "ses_f5966a878ffe9Eqsv9NxdkApEz",
    "runId": "run_01M2GDZ3Q3S5WYCB3MV02QJXZ1",
    "workflow": "execute-scr",
    "agent": ".claude/scripts/sessions/ingest.mjs"
  }
}
