{
  "schemaVersion": "1",
  "kind": "maxwell.session.summary",
  "sessionId": "ses_f59232d60ffenPqTdOiYtNJacW",
  "harness": "opencode",
  "harnessVersion": "1.18.30",
  "runId": "run_01M2GDZ3Q3S5WYCB3MV02QJXZ1",
  "workflow": "execute-scr",
  "companyId": "example-co",
  "startedAt": "2026-09-15T20:58:05Z",
  "endedAt": "2026-09-15T20:59:19Z",
  "durationMs": 74000,
  "turns": 1,
  "inferenceCalls": 1,
  "toolCalls": {
    "total": 0,
    "byTool": {}
  },
  "subagentSessions": 0,
  "permissionDenials": [],
  "models": [
    {
      "model": "glm-5.3",
      "provider": "other",
      "tokens": {
        "input": 0,
        "output": 0,
        "cacheWrite5m": 0,
        "cacheWrite1h": 0,
        "cacheRead": 0,
        "thinking": null
      },
      "webSearchRequests": 0,
      "webFetchRequests": 0,
      "costUsd": 0
    }
  ],
  "costUsd": {
    "computed": 0,
    "reported": 0,
    "deltaPct": null
  },
  "pricingVersion": "2026-09-14",
  "dedup": {
    "strategy": "requestId-max-total-tokens",
    "duplicatesDropped": 0
  },
  "filesWritten": [],
  "linesAdded": 0,
  "linesRemoved": 0,
  "outcome": "success",
  "transcriptFormatVersion": "1.18.30",
  "provenance": {
    "harness": "script",
    "generatedAt": "2026-09-15T23:45:27Z",
    "sessionId": "ses_f59232d60ffenPqTdOiYtNJacW",
    "runId": "run_01M2GDZ3Q3S5WYCB3MV02QJXZ1",
    "workflow": "execute-scr",
    "agent": ".claude/scripts/sessions/ingest.mjs"
  }
}
