{
  "schemaVersion": "1",
  "kind": "maxwell.session.summary",
  "sessionId": "ses_f5c81fa8affejKshWjuV8HQ7Lb",
  "harness": "opencode",
  "harnessVersion": "1.18.30",
  "runId": "run_01M2GDZ3Q3S5WYCB3MV02QJXZ1",
  "workflow": "probe-schemas",
  "companyId": "example-co",
  "startedAt": "2026-09-15T05:15:40Z",
  "endedAt": "2026-09-15T05:28:11Z",
  "durationMs": 751000,
  "turns": 20,
  "inferenceCalls": 20,
  "toolCalls": {
    "total": 35,
    "byTool": {
      "bash": 30,
      "read": 5
    }
  },
  "subagentSessions": 0,
  "permissionDenials": [],
  "models": [
    {
      "model": "glm-5.3",
      "provider": "other",
      "tokens": {
        "input": 185195,
        "output": 78197,
        "cacheWrite5m": 0,
        "cacheWrite1h": 0,
        "cacheRead": 2239744,
        "thinking": null
      },
      "webSearchRequests": 0,
      "webFetchRequests": 0,
      "costUsd": 1.185673
    }
  ],
  "costUsd": {
    "computed": 1.185673,
    "reported": 1.185673,
    "deltaPct": 0
  },
  "pricingVersion": "2026-09-14",
  "dedup": {
    "strategy": "requestId-max-total-tokens",
    "duplicatesDropped": 0
  },
  "filesWritten": [],
  "linesAdded": 0,
  "linesRemoved": 0,
  "outcome": "success",
  "transcriptFormatVersion": "1.18.30",
  "provenance": {
    "harness": "script",
    "generatedAt": "2026-09-15T06:06:46Z",
    "sessionId": "ses_f5c81fa8affejKshWjuV8HQ7Lb",
    "runId": "run_01M2GDZ3Q3S5WYCB3MV02QJXZ1",
    "workflow": "probe-schemas",
    "agent": ".claude/scripts/sessions/ingest.mjs"
  }
}
