{
  "schemaVersion": "1",
  "kind": "maxwell.session.summary",
  "sessionId": "ses_f59a5f20cffeofRSP4jiXGqWIx",
  "harness": "opencode",
  "harnessVersion": "1.18.30",
  "runId": "run_01M2GDZ3Q3S5WYCB3MV02QJXZ1",
  "workflow": "probe-agent-graph",
  "companyId": "example-co",
  "startedAt": "2026-09-15T18:35:15Z",
  "endedAt": "2026-09-15T18:46:35Z",
  "durationMs": 680000,
  "turns": 9,
  "inferenceCalls": 9,
  "toolCalls": {
    "total": 50,
    "byTool": {
      "read": 17,
      "grep": 30,
      "glob": 3
    }
  },
  "subagentSessions": 0,
  "permissionDenials": [],
  "models": [
    {
      "model": "glm-5.3",
      "provider": "other",
      "tokens": {
        "input": 92501,
        "output": 44361,
        "cacheWrite5m": 0,
        "cacheWrite1h": 0,
        "cacheRead": 386048,
        "thinking": null
      },
      "webSearchRequests": 0,
      "webFetchRequests": 0,
      "costUsd": 0.425062
    }
  ],
  "costUsd": {
    "computed": 0.425062,
    "reported": 0.425062,
    "deltaPct": 0
  },
  "pricingVersion": "2026-09-14",
  "dedup": {
    "strategy": "requestId-max-total-tokens",
    "duplicatesDropped": 0
  },
  "filesWritten": [],
  "linesAdded": 0,
  "linesRemoved": 0,
  "outcome": "success",
  "transcriptFormatVersion": "1.18.30",
  "provenance": {
    "harness": "script",
    "generatedAt": "2026-09-15T19:42:14Z",
    "sessionId": "ses_f59a5f20cffeofRSP4jiXGqWIx",
    "runId": "run_01M2GDZ3Q3S5WYCB3MV02QJXZ1",
    "workflow": "probe-agent-graph",
    "agent": ".claude/scripts/sessions/ingest.mjs"
  }
}
