{
  "schemaVersion": "1",
  "kind": "maxwell.session.summary",
  "sessionId": "ses_f5874553effebR0GR1SkAa6YKg",
  "harness": "opencode",
  "harnessVersion": "1.18.30",
  "runId": "run_01M2GDZ3Q3S5WYCB3MV02QJXZ1",
  "workflow": "impl-change-management",
  "companyId": "example-co",
  "startedAt": "2026-09-16T00:09:04Z",
  "endedAt": "2026-09-16T00:12:31Z",
  "durationMs": 207000,
  "turns": 3,
  "inferenceCalls": 3,
  "toolCalls": {
    "total": 9,
    "byTool": {
      "read": 9
    }
  },
  "subagentSessions": 0,
  "permissionDenials": [],
  "models": [
    {
      "model": "glm-5.3",
      "provider": "other",
      "tokens": {
        "input": 40704,
        "output": 633,
        "cacheWrite5m": 0,
        "cacheWrite1h": 0,
        "cacheRead": 20032,
        "thinking": null
      },
      "webSearchRequests": 0,
      "webFetchRequests": 0,
      "costUsd": 0.064979
    }
  ],
  "costUsd": {
    "computed": 0.064979,
    "reported": 0.064979,
    "deltaPct": 0
  },
  "pricingVersion": "2026-09-14",
  "dedup": {
    "strategy": "requestId-max-total-tokens",
    "duplicatesDropped": 0
  },
  "filesWritten": [],
  "linesAdded": 0,
  "linesRemoved": 0,
  "outcome": "success",
  "transcriptFormatVersion": "1.18.30",
  "provenance": {
    "harness": "script",
    "generatedAt": "2026-09-16T02:14:39Z",
    "sessionId": "ses_f5874553effebR0GR1SkAa6YKg",
    "runId": "run_01M2GDZ3Q3S5WYCB3MV02QJXZ1",
    "workflow": "impl-change-management",
    "agent": ".claude/scripts/sessions/ingest.mjs"
  }
}
