{
  "schemaVersion": "1",
  "kind": "maxwell.session.summary",
  "sessionId": "ses_f57efb3b3ffevaF4pJ6DuAHdN3",
  "harness": "opencode",
  "harnessVersion": "1.18.30",
  "runId": "run_01M2GDZ3Q3S5WYCB3MV02QJXZ1",
  "workflow": "impl-auto-improvement",
  "companyId": "example-co",
  "startedAt": "2026-09-16T02:33:56Z",
  "endedAt": "2026-09-16T02:50:30Z",
  "durationMs": 994000,
  "turns": 16,
  "inferenceCalls": 16,
  "toolCalls": {
    "total": 28,
    "byTool": {
      "read": 13,
      "bash": 10,
      "grep": 5
    }
  },
  "subagentSessions": 0,
  "permissionDenials": [],
  "models": [
    {
      "model": "glm-5.3",
      "provider": "other",
      "tokens": {
        "input": 75722,
        "output": 23784,
        "cacheWrite5m": 0,
        "cacheWrite1h": 0,
        "cacheRead": 561856,
        "thinking": null
      },
      "webSearchRequests": 0,
      "webFetchRequests": 0,
      "costUsd": 0.356743
    }
  ],
  "costUsd": {
    "computed": 0.356743,
    "reported": 0.356743,
    "deltaPct": 0
  },
  "pricingVersion": "2026-09-14",
  "dedup": {
    "strategy": "requestId-max-total-tokens",
    "duplicatesDropped": 0
  },
  "filesWritten": [],
  "linesAdded": 0,
  "linesRemoved": 0,
  "outcome": "success",
  "transcriptFormatVersion": "1.18.30",
  "provenance": {
    "harness": "script",
    "generatedAt": "2026-09-16T03:59:24Z",
    "sessionId": "ses_f57efb3b3ffevaF4pJ6DuAHdN3",
    "runId": "run_01M2GDZ3Q3S5WYCB3MV02QJXZ1",
    "workflow": "impl-auto-improvement",
    "agent": ".claude/scripts/sessions/ingest.mjs"
  }
}
