{
  "schemaVersion": "1",
  "kind": "maxwell.session.summary",
  "sessionId": "ses_f5d3fa7b4ffekyZFB53yWLdv0E",
  "harness": "opencode",
  "harnessVersion": "1.18.30",
  "runId": "run_01M2GDZ3Q3S5WYCB3MV02QJXZ1",
  "workflow": "probe-iac",
  "companyId": "example-co",
  "startedAt": "2026-09-15T01:48:30Z",
  "endedAt": "2026-09-15T01:51:37Z",
  "durationMs": 187000,
  "turns": 7,
  "inferenceCalls": 7,
  "toolCalls": {
    "total": 17,
    "byTool": {
      "read": 9,
      "glob": 3,
      "grep": 5
    }
  },
  "subagentSessions": 0,
  "permissionDenials": [],
  "models": [
    {
      "model": "glm-5.3",
      "provider": "other",
      "tokens": {
        "input": 24875,
        "output": 8591,
        "cacheWrite5m": 0,
        "cacheWrite1h": 0,
        "cacheRead": 179712,
        "thinking": null
      },
      "webSearchRequests": 0,
      "webFetchRequests": 0,
      "costUsd": 0.119351
    }
  ],
  "costUsd": {
    "computed": 0.119351,
    "reported": 0.119351,
    "deltaPct": 0
  },
  "pricingVersion": "2026-09-14",
  "dedup": {
    "strategy": "requestId-max-total-tokens",
    "duplicatesDropped": 0
  },
  "filesWritten": [],
  "linesAdded": 0,
  "linesRemoved": 0,
  "outcome": "success",
  "transcriptFormatVersion": "1.18.30",
  "provenance": {
    "harness": "script",
    "generatedAt": "2026-09-15T02:41:29Z",
    "sessionId": "ses_f5d3fa7b4ffekyZFB53yWLdv0E",
    "runId": "run_01M2GDZ3Q3S5WYCB3MV02QJXZ1",
    "workflow": "probe-iac",
    "agent": ".claude/scripts/sessions/ingest.mjs"
  }
}
