{
  "schemaVersion": "1",
  "kind": "maxwell.session.summary",
  "sessionId": "ses_f557a14d0ffenllwfDIOvBwOHE",
  "harness": "opencode",
  "harnessVersion": "1.18.30",
  "runId": "run_01M2GDZ3Q3S5WYCB3MV02QJXZ1",
  "workflow": "probe-cicd-env",
  "companyId": "example-co",
  "startedAt": "2026-09-16T14:01:38Z",
  "endedAt": "2026-09-16T14:03:14Z",
  "durationMs": 96000,
  "turns": 2,
  "inferenceCalls": 2,
  "toolCalls": {
    "total": 2,
    "byTool": {
      "read": 1,
      "glob": 1
    }
  },
  "subagentSessions": 0,
  "permissionDenials": [],
  "models": [
    {
      "model": "glm-5.3",
      "provider": "other",
      "tokens": {
        "input": 1324,
        "output": 268,
        "cacheWrite5m": 0,
        "cacheWrite1h": 0,
        "cacheRead": 10624,
        "thinking": null
      },
      "webSearchRequests": 0,
      "webFetchRequests": 0,
      "costUsd": 0.005795
    }
  ],
  "costUsd": {
    "computed": 0.005795,
    "reported": 0.005795,
    "deltaPct": 0
  },
  "pricingVersion": "2026-09-14",
  "dedup": {
    "strategy": "requestId-max-total-tokens",
    "duplicatesDropped": 0
  },
  "filesWritten": [],
  "linesAdded": 0,
  "linesRemoved": 0,
  "outcome": "success",
  "transcriptFormatVersion": "1.18.30",
  "provenance": {
    "harness": "script",
    "generatedAt": "2026-09-16T16:10:45Z",
    "sessionId": "ses_f557a14d0ffenllwfDIOvBwOHE",
    "runId": "run_01M2GDZ3Q3S5WYCB3MV02QJXZ1",
    "workflow": "probe-cicd-env",
    "agent": ".claude/scripts/sessions/ingest.mjs"
  }
}
